title,overview,price,stock,description,link
22421 Poolife NST Non Stabilized Swimming Pool Chlorine Tablet 20.6lb,"Use only in pools with a skimmer and skimmer basket., Skimmer basket should be free of all other water treatment., Place tablet in the empty skimmer basket., Replace with a new tablet as needed. Do not mix with other products or dissolve before use.",$185.76,Only 7 left in stock,Poolife NST Non Stabilized Without Conditioner Swimming Pool Chlorine Tablet 20.6lb 22421 in_store_price: $171.99 product_id: 36140 calcium hypochlorite: 70.2% other ingredients: 29.8% manufacturer sku: 22421,https://bestpoolshop.com/product/poolife-nst-non-stabilized-swimming-pool-chlorine-tablet-20-6lb-22421/
22422 Poolife NST Non Stabilized Swimming Pool Chlorine Tablet 44lb,"Use only in pools with a skimmer and skimmer basket., Skimmer basket should be free of all other water treatment., Place tablet in the empty skimmer basket., Replace with a new tablet as needed. Do not mix with other products or dissolve before use.",,1 in stock,Poolife NST Non Stabilized Without Conditioner Swimming Pool Chlorine Tablet 44lb 22422 in_store_price: $234.99 product_id: 80944 calcium hypochlorite: 70.2% other ingredients: 29.8% manufacturer sku: 22422,https://bestpoolshop.com/product/poolife-nst-non-stabilized-swimming-pool-chlorine-tablet-44lb-22422/
Bulk 50lb 3inch Chlorine Tablets For Swimming Pools – 10 Buckets,"Do not allow this product to get damp or wet before use., Do not allow this product to contact other water treatment products., Do not use in a floaters or feeders that have been used with other dry chlorinating products., If placed in a skimmer, run the pump a minimum of 8 hours daily., Make sure skimmer is completely clean and free of residue from other water treatment products before putting this product in the skimmer., Do not use with other tablets or sticks in the same skimmer, floater, or feeder., Do not permit tablets to contact plastic pool linings or metal objects., Do not throw tablets directly into pool.",,2 in stock,Swimming Pool 3 inch Stabilized Chlorine Tablets 50lb Bucket – 10 Buckets in_store_price: $1500.00 product_id: 110412 other ingredients: 1% trichlor-s-triazinetrione: 99% available chlorine: 90%,https://bestpoolshop.com/product/50lb-3inch-chlorine-tablets-for-swimming-pools-10-buckets-2/
CVBR004 Clearview Bromo Bromine Brominating 1in. Tablets 4lb.,"96% Bromine, Slow dissolving, Reduced odor, Ensures safe, sanitary, and sparkling water, Sanitizer / Sanitizers",$71.99,Only 8 left in stock,"Oreq Clearview Swimming Pool and Spa Bromo Bromine Brominating 1in. Tablets Tabs for Bromine Tablets for Hot Tub Spa 4lb. CVBR004 in_store_price: $64.99 product_id: 119703 active ingredient: 1-Bromo-3-chloro-5,5-dimethylhydantoin – 96.0% manufacturer sku: CVBR004",https://bestpoolshop.com/product/clearview-bromo-bromine-brominating-1in-tablets-4lb-cvbr004/
CVTLST005 ClearView Swimming Pool Spa Chlorine Chlorinating 3 inch Tablets Pucks Tabs 5 lbs.,"World’s First Low-Odor Chlorine TabsExperience cleaner, fresher pool maintenance without the overwhelming chlorine smell, thanks to Scent-Trific’s innovative low-odor formula., Full-Strength PerformanceEach tablet is formulated with 99% premium-grade Trichlor, ensuring maximum sanitizing power to keep your pool or spa safe, sanitary, and inviting., No Gummy BindersUnlike other products, Scent-Trific tablets are free of gummy binders, which means no residue or buildup to clog skimmers, chlorinators, or filters., Reduced Storage OdorEven in storage, these tabs maintain a fresher scent, making them easy to store indoors or in enclosed spaces without the usual chemical odor., Hassle-Free UseDesigned for compatibility with most automatic chlorinators and skimmers, these tabs dissolve evenly without leaving films or causing clogs., Sparkling, Crystal-Clear WaterScent-Trific Chlorine Plus Tabs not only sanitize but also ensure your pool or spa remains visually stunning with safe, clear, and balanced water.",$48.99,Only 3 left in stock,"CVTLST005 Scent-Trific ClearView Swimming Pool Spa Chlorine Chlorinating 3 inch Tablets Pucks Tabs 5 lbs. Scent-Trific Tabs are low odor, full strength Tabs in_store_price: $41.99 product_id: 137117 manufacturer sku: CVTLST005",https://bestpoolshop.com/product/cvtlst005-clearview-swimming-pool-spa-chlorine-chlorinating-3-inch-tablets-pucks-tabs-5-lbs/
CVTLST010 ClearView Swimming Pool Spa Chlorine Chlorinating 3 inch Tablets Pucks Tabs 10 lbs.,"World’s First Low-Odor Chlorine TabsExperience cleaner, fresher pool maintenance without the overwhelming chlorine smell, thanks to Scent-Trific’s innovative low-odor formula., Full-Strength PerformanceEach tablet is formulated with 99% premium-grade Trichlor, ensuring maximum sanitizing power to keep your pool or spa safe, sanitary, and inviting., No Gummy BindersUnlike other products, Scent-Trific tablets are free of gummy binders, which means no residue or buildup to clog skimmers, chlorinators, or filters., Reduced Storage OdorEven in storage, these tabs maintain a fresher scent, making them easy to store indoors or in enclosed spaces without the usual chemical odor., Hassle-Free UseDesigned for compatibility with most automatic chlorinators and skimmers, these tabs dissolve evenly without leaving films or causing clogs., Sparkling, Crystal-Clear WaterScent-Trific Chlorine Plus Tabs not only sanitize but also ensure your pool or spa remains visually stunning with safe, clear, and balanced water.",$86.99,Only 2 left in stock,"CVTLST010 Scent-Trific ClearView Swimming Pool Spa Chlorine Chlorinating 3 inch Tablets Pucks Tabs 10 lbs. Scent-Trific Tabs are low odor, full strength Tabs in_store_price: $67.99 product_id: 137128 manufacturer sku: CVTLST010",https://bestpoolshop.com/product/cvtlst010-clearview-swimming-pool-spa-chlorine-chlorinating-3-inch-tablets-pucks-tabs-10-lbs/
CVTS005 ClearView Swimming Pool Spa Chlorine Chlorinating 1 inch Tablets Pucks Tabs 5 lbs.,,$49.99,In stock,Oreq ClearView Swimming Pool Spa Chlorine Chlorinating 1 inch Tablets Pucks Tabs 5 lbs. CVTS005 in_store_price: $42.99 product_id: 118986 manufacturer sku: CVTS005,https://bestpoolshop.com/product/clearview-swimming-pool-spa-chlorine-chlorinating-1-inch-tablets-pucks-tabs-5-lbs-cvts005/
Pool Chlorine Tablets 25lb 3 inch Jumbo,,,11 in stock,Swimming Pool 3 inch Chlorine Tablets 25lb Bucket in_store_price: $114.99 product_id: 65656,https://bestpoolshop.com/product/swimming-pool-3-inch-chlorine-tablets-25lb-bucket/
Pool Chlorine Tablets 50lb for 3 inch Jumbo ClearView,"Do not allow this product to get damp or wet before use., Do not allow this product to contact other water treatment products., Do not use in a floaters or feeders that have been used with other dry chlorinating products., If placed in a skimmer, run the pump a minimum of 8 hours daily., Make sure skimmer is completely clean and free of residue from other water treatment products before putting this product in the skimmer., Do not use with other tablets or sticks in the same skimmer, floater, or feeder., Do not permit tablets to contact plastic pool linings or metal objects., Do not throw tablets directly into pool.",,8 in stock,Swimming Pool 3 inch Stabilized Chlorine Tablets 50lb Bucket in_store_price: $179.99 product_id: 80282 other ingredients: 1% trichlor-s-triazinetrione: 99% available chlorine: 90%,https://bestpoolshop.com/product/50lb-3inch-chlorine-tablets-for-swimming-pools/
42104 Swimming Pool Chlorine Chlorinating 1 inch Tablets Pucks Tabs 5 lbs.,"Four one-half ounce tablets per 10,000 gallons of water per day or as need to maintain chlorine level of 1-4 ppm",$64.99,Out of stock,Poolife Small 1 inch Swimming Pool and Spa Chlorinating Tablets 5 lbs. 42104 product_id: 92700 manufacturer sku: 42104,https://bestpoolshop.com/product/poolife-small-1-inch-chlorinating-tablets-5-lbs-42104/
62122 Hasa Small Chlorinating Tablets 2 lbs.,,$18.05,Out of stock,Hasa Small Chlorinating Tablets 2 lbs. 62122 product_id: 32070 manufacturer sku: 62122,https://bestpoolshop.com/product/hasa-small-chlorinating-tablets-2-lbs-62122/
62122 Hasa Small Chlorinating Tablets 2 lbs. 2-Pack Multi-Pack,,$35.11,Out of stock,Hasa Small Chlorinating Tablets 2 lbs. 62122 product_id: 32071 manufacturer sku: 62122,https://bestpoolshop.com/product/hasa-small-chlorinating-tablets-2-lbs-62122-2-pack/
63084 Hasa Swimming Pool Chlorine Tablets 3in. 4.37lb.,,$59.99,Out of stock,Hasa Swimming Pool 3in. Jumbo Tri-chlor Chlorine Tablets 4.37lb. 63084 product_id: 80283 manufacturer sku: 63084,https://bestpoolshop.com/product/hasa-swimming-pool-chlorine-tablets-3in-4-37lb-63084/
84121 Hasa Brominating Tablets 1.5lbs,,$39.99,Out of stock,Hasa Brominating Tablets 1in 1.5lbs 84121 product_id: 32137 manufacturer sku: 84121,https://bestpoolshop.com/product/hasa-brominating-tablets-1-5lbs-84121/
84121 Hasa Brominating Tablets 1.5lbs 2-Pack Multi-Pack,,$79.98,Out of stock,Hasa Brominating Tablets 1in 1.5lbs 84121 product_id: 32138 manufacturer sku: 84121,https://bestpoolshop.com/product/hasa-brominating-tablets-1-5lbs-84121-2-pack/
GLB Swimming Pool Chlorine 3in. Jumbo Tablet Triple Tab Jumbo 22.5 lb,"Contains copper sulfate to kill algae, Stabilized for extended chlorine life, Clarifies pool water, Protects against algae and bacteria",$169.99,Out of stock,GLB Swimming Pool Chlorinating Jumbo 3in. Tablet Triple Tab Jumbo 22.5 lb 71446A product_id: 81624,https://bestpoolshop.com/product/glb-swimming-pool-chlorine-3in-jumbo-tablet-triple-tab-jumbo-22-5-lb/
